{
  "schema_version": "1.0",
  "job_id": "job-draft01",
  "trace_id": "trace-a7b9c1",
  "job_type": "DRAFT",
  "status": "SUCCEEDED",
  "execution": {
    "created_at": "2026-09-10T10:00:00Z",
    "queued_at": "2026-09-10T10:00:01Z",
    "started_at": "2026-09-10T10:00:05Z",
    "finished_at": "2026-09-10T10:03:12Z",
    "attempts": 2,
    "runner": "runner-01"
  },
  "input": {
    "repository": {
      "url": "https://github.com/example/clib",
      "commit": "0123456789abcdef0123456789abcdef01234567"
    },
    "build": { "command": "make", "workdir": "/app" },
    "verify": { "command": "make test" },
    "max_iterations": 10,
    "time_limit": 1800,
    "idempotency_key": "draft-clib-01"
  },
  "output": {
    "dockerfile": "FROM ubuntu:22.04\nRUN apt-get update && apt-get install -y build-essential\nWORKDIR /app\nCOPY . .\nRUN make",
    "image_ref": "b07/clib:generated",
    "rounds": [
      {
        "iteration": 1,
        "log": "[round 1] docker build failed: /bin/sh: 1: make: not found",
        "changes": "add build-essential to apt-get install",
        "rationale": "构建镜像缺少 make 工具链；依据首轮日志补全编译依赖后重试"
      },
      {
        "iteration": 2,
        "log": "[round 2] docker build succeeded; make test: 12 passed, 0 failed",
        "changes": "no change; keep Dockerfile from round 2",
        "rationale": "构建与验证均通过，满足 verify.command，收敛并停止迭代"
      }
    ],
    "final_build": "success",
    "final_verify": "make test passed"
  },
  "error": null
}